Product ID,Locale; Title; Description,Auto Fill Prices,Price,IAP Type
com.cleverapps.candyriddles.unlimitedlives,en_US;3 Days of Unlimited Lives;Unlimited Lives for 3 days!;es_ES;3 días de vidas ilimitadas;¡Vidas ilimitadas por 3 días!;it_IT;3 giorni di vite illimitate;Vite illimitate per 3 giorni!;fr_FR;3 jours de vies illimitées;Des vies illimitées pour 3 jours!;pt_BR;3 dias de vidas ilimitadas;Vidas ilimitadas por 3 dias!;de_DE;3 Tage unbegrenztes Leben;Unbegrenzte Leben für 3 Tage!;ja_JP;3日間の無制限の生活;3日間無限のライフ!,FALSE,US;2990000;BR;9670000;GB;2990000;AU;2990000;JP;333000000;FR;2990000;DE;2990000;ES;2990000;IN;190160000;IT;2990000;CA;2990000,CONSUMABLE
com.cleverapps.candyriddles.100gold,en_US;Fistful of Gold;Fistful of Gold - 100 gold coins!;es_ES;Fistful of Gold;¡Fistful of Gold - 100 monedas de oro!;it_IT;Pugno di oro;Pugno di oro - 100 monete d'oro!;fr_FR;Fidèle à l'or;Fidèle à l'or - 100 pièces d'or!;pt_BR;Fistful of Gold;Fistful of Gold - 100 moedas de ouro!;de_DE;Handvoll Gold;Handvoll Gold - 100 Goldmünzen!,FALSE,US;990000;BR;3200000;GB;990000;AU;990000;JP;110000000;FR;990000;DE;990000;ES;990000;IN;62960000;IT;990000;CA;990000,CONSUMABLE
com.cleverapps.candyriddles.exp4,en_US;50 lollipop;50 lollipops with amazing discount!;es_ES;50 piruletas;¡50 piruletas con un descuento increíble!;it_IT;50 lecca-lecca;50 lecca-lecca con uno sconto eccezionale!;fr_FR;50 sucettes;50 sucettes avec une remise incroyable!;pt_BR;50 pirulito;50 pirulitos com desconto incrível!;de_DE;50 Lutscher;50 Lutscher mit unglaublichem Rabatt!;ja_JP;50ロリポップ;驚くほどの割引で50個のロリポップ!,FALSE,US;3990000;BR;15990000;GB;3990000;AU;3990000;JP;399000000;FR;3990000;DE;3990000;ES;3990000;IN;279000000;IT;3990000;CA;3990000,CONSUMABLE
com.cleverapps.candyriddles.exp1,en_US;25 lollipops;25 lollipops with amazing discount!;es_ES;25 piruletas;¡25 piruletas con un descuento increíble!;it_IT;25 lecca-lecca;25 lecca-lecca con uno sconto eccezionale!;fr_FR;25 sucettes;25 sucettes avec une remise incroyable!;pt_BR;25 pirulitos;25 pirulitos com desconto incrível!;de_DE;25 Lutscher;25 Lutscher mit unglaublichem Rabatt!;ja_JP;25個のロリポップ;25個のロリポップと驚くほどの割引!,FALSE,US;1990000;BR;7990000;GB;1990000;AU;1990000;JP;199000000;FR;1990000;DE;1990000;ES;1990000;IN;139000000;IT;1990000;CA;1990000,CONSUMABLE
com.cleverapps.candyriddles.lives3,en_US;100x Lives;100x Lives with amazing discount!;es_ES;100x vidas;¡Vive 100 veces con un descuento increíble!;it_IT;100x Lives;100x Lives con uno sconto incredibile!;fr_FR;100x vies;100x vit avec une remise incroyable!;pt_BR;100x vidas;100x vidas com desconto incrível!;de_DE;100x Leben;100x lebt mit erstaunlichen Rabatt!;ja_JP;100ライフ;驚くほどの割引で100ライフ!,FALSE,US;2990000;BR;11990000;GB;2990000;AU;2990000;JP;299000000;FR;2990000;DE;2990000;ES;2990000;IN;209000000;IT;2990000;CA;2990000,CONSUMABLE
com.cleverapps.candyriddles.unlimitedlives05,en_US;3 Days of Unlimited Lives;Unlimited Lives for 3 days with amazing discount!;es_ES;3 días de vidas ilimitadas;¡Vidas ilimitadas por 3 días con un descuento increíble!;it_IT;3 giorni di vite illimitate;Vite illimitate per 3 giorni con uno sconto eccezionale!;fr_FR;3 jours de vies illimitées;Unlimited Lives pendant 3 jours avec une réduction incroyable!;pt_BR;3 dias de vidas ilimitadas;Unlimited Lives por 3 dias com incríveis descontos!;de_DE;3 Tage unbegrenztes Leben;Unbegrenzte Leben für 3 Tage mit unglaublichem Rabatt!;ja_JP;3日間の無制限の生活;驚くべき割引で3日間無限のライブ!,FALSE,US;990000;BR;1990000;GB;990000;AU;990000;JP;99000000;FR;990000;DE;990000;ES;990000;IN;29000000;IT;990000;CA;990000,CONSUMABLE
com.cleverapps.candyriddles.lives074,en_US;50x Lives;50x Lives with amazing discount!;es_ES;50x vidas;¡50x vidas con un descuento increíble!;it_IT;50x Lives;50x Lives con uno sconto eccezionale!;fr_FR;50x vies;50x vit avec une remise incroyable!;pt_BR;50x vidas;50x vidas com desconto incrível!;de_DE;50x Leben;50x lebt mit erstaunlichen Rabatt!;ja_JP;50ライフ;驚くほどの割引で50ライフ!,FALSE,US;990000;BR;3990000;GB;990000;AU;990000;JP;99000000;FR;990000;DE;990000;ES;990000;IN;69990000;IT;990000;CA;990000,CONSUMABLE
com.cleverapps.candyriddles.unlimitedlives2,en_US;3 Days of Unlimited Lives;Unlimited Lives for 5 days!;es_ES;3 días de vidas ilimitadas;¡Vidas ilimitadas por 5 días!;it_IT;3 giorni di vite illimitate;Vite illimitate per 5 giorni!;fr_FR;3 jours de vies illimitées;Durée de vie illimitée pendant 5 jours!;pt_BR;3 dias de vidas ilimitadas;Vidas Ilimitadas por 5 dias!;de_DE;3 Tage unbegrenztes Leben;Unbegrenzte Leben für 5 Tage!;ja_JP;3日間の無制限の生活;5日間無限のライフ!,FALSE,US;1990000;BR;7990000;GB;1990000;AU;1990000;JP;199000000;FR;1990000;DE;1990000;ES;1990000;IN;139000000;IT;1990000;CA;1990000,CONSUMABLE
